[{"code":"VH","name":"Very-High","pretty":"Very-High","reporting":"very-high"},{"code":"H","name":"High","pretty":"High","reporting":"high"},{"code":"MF","name":"Mostly-Factual","pretty":"Mostly-Factual","reporting":"mostly-factual"},{"code":"M","name":"Mixed","pretty":"Mixed","reporting":"mixed"},{"code":"L","name":"Low","pretty":"Low","reporting":"low"},{"code":"VL","name":"Very-Low","pretty":"Very-Low","reporting":"very-low"}]